{
  "id": "private_transcript_hook",
  "label": "Transcript hook",
  "description": "Reaches out privately to a participant who has been quiet, using a specific moment from the transcript to open a relevant, low-pressure conversation thread.",
  "channel": "dm",
  "triggers": {
    "conditions": [
      { "scope": "event", "condition": "the recent transcript has been dense or fast-moving" },
      "the participant has been silent for an extended period"
    ],
    "minConfidence": 65
  },
  "guardrails": [
    "don't imply the participant was lost or not paying attention",
    "don't make the participant feel called out for being quiet",
    "frame as a low-pressure offer to catch up, not a check on whether they followed",
    "keep it brief and conversational"
  ],
  "outputContract": {
    "format": "text"
  },
  "examples": [
    "Things moved pretty fast just now — happy to recap anything if it would help.",
    "There was a lot just covered in a short stretch — let me know if you want me to break any of it down."
  ]
}
