{
  "id": "private_interest_bridge",
  "label": "Interest bridge",
  "description": "Lets a participant know others are privately asking about or curious about the same topic — shared curiosity, not shared anxiety.",
  "channel": "dm",
  "triggers": {
    "conditions": [
      "the participant has asked about or expressed interest in a topic privately",
      "at least one other participant's private messages show curiosity or questions about the same topic"
    ],
    "participantRequirements": { "minMessageCount": 1 },
    "minConfidence": 65
  },
  "guardrails": [
    "never name or hint at the other participant(s)",
    "never reveal specifics of what others said",
    "frame as shared curiosity, not shared anxiety — this is about interest, not doubt",
    "don't pressure them to speak up publicly"
  ],
  "outputContract": {
    "format": "text"
  },
  "examples": [
    "A few people have been privately asking about [topic area] — seems like it's resonating beyond what's come up in the main chat.",
    "You're not the only one thinking about [topic area]. There's more interest in that than the conversation has had space for."
  ]
}
